{
  "$type": "InfiniteImbueFramework.ItemModuleInfiniteImbue, InfiniteImbueFramework",
  "schemaVersion": 1,
  "spells": [
    { "spellId": "Fire", "level": 1.0 },
    { "spellId": "Lightning", "level": 1.0 },
    { "spellId": "Gravity", "level": 0.85 }
  ],
  "assignmentMode": "ConditionalHandVelocity",
  "conflictPolicy": "ForceConfiguredSpell",
  "applyOnSpawn": true,
  "keepFilled": true,
  "updateInterval": 0.2,
  "maintainBelowRatio": 0.97,
  "refillToRatio": 1.0,
  "minSetEnergyInterval": 0.4,
  "conditionalVelocityThreshold": 6.0,
  "conditionalVelocityHysteresis": 1.0,
  "conditionalMinSwitchInterval": 0.25
}
